{
  "registry_version": 2,
  "pinned_sha": "2b7d6480cf3b6dbcaf6e9ed6c4c60bdad9826d47",
  "last_revalidated": "2026-09-15",
  "design_claims": [
    {
      "id": "spec-is-authoritative-source",
      "statement": "docs/LHGP-SPEC.md 为协议语义的唯一真相源；任何代码/测试/示例引入的概念必须在 SPEC 中可定位；SPEC 修改门槛高于代码与 ROADMAP。",
      "lifecycle": "verified",
      "scope_paths": [
        "docs/LHGP-SPEC.md",
        "docs/LHGP-ROADMAP.md",
        "docs/decisions/"
      ],
      "evidence": [
        {
          "kind": "manual_review",
          "path": "docs/LHGP-SPEC.md",
          "recorded_at": "2026-09-01",
          "summary": "SPEC §22（Always）：规范先行；§19.3：改名最后；ROADMAP §三执行原则 1「规范先行」与之一致。SPEC 当前 v1（26 章），未与代码冲突。"
        },
        {
          "kind": "source_static",
          "path": "docs/LHGP-ROADMAP.md",
          "recorded_at": "2026-09-01",
          "summary": "ROADMAP §八变更规则：SPEC 与本文档冲突时先改 SPEC；本文档区分历史基线、当前实现与后续目标。"
        }
      ],
      "notes": "每次 SPEC 修订或代码新增概念后重验。"
    },
    {
      "id": "lhgp-spec-four-axis-model",
      "statement": "承诺状态被显式分为四条独立状态轴（SPEC §7）：commitment lifecycle / deadline_status / acceptance_status / attempt state；当前实现已落地四轴数据与状态迁移，严格 deadline 交付保证仍是独立债务。",
      "lifecycle": "verified",
      "scope_paths": [
        "docs/LHGP-SPEC.md"
      ],
      "evidence": [
        {
          "kind": "source_static",
          "path": "docs/LHGP-SPEC.md",
          "recorded_at": "2026-09-01",
          "summary": "SPEC §7 明确四轴；§7.1「complete → satisfied」语义合并入 deadline 轴；历史冲突项见 ROADMAP §2.3，当前实现与复验状态见 §2.1–§2.2。"
        }
      ]
    },
    {
      "id": "lhgp-spec-authorization-tri-axis",
      "statement": "合同授权三维 allowlist：executor / model / role；候选必须同时满足 SPEC §6.3 的 7 个条件；不合格默认拒接（default-deny）；属 P2 范围。",
      "lifecycle": "verified",
      "scope_paths": [
        "docs/LHGP-SPEC.md"
      ],
      "evidence": [
        {
          "kind": "source_static",
          "path": "docs/LHGP-SPEC.md",
          "recorded_at": "2026-09-01",
          "summary": "SPEC §6.3 列出 7 个候选条件；§6.1 给出 authority/attention/continuity 三组字段；当前实现已执行 executor/model/role 授权与 default-deny 判定。"
        }
      ]
    },
    {
      "id": "lhgp-spec-external-handles",
      "statement": "spawn 必须返回 external_run_id / session_locator / recovery_strategy / capability_snapshot（SPEC §11.3）；daemon 启动走四分支 reconciliation：reattach / collect / orphan grace / fence 后重派；属 P3 范围。",
      "lifecycle": "verified",
      "scope_paths": [
        "docs/LHGP-SPEC.md"
      ],
      "evidence": [
        {
          "kind": "source_static",
          "path": "docs/LHGP-SPEC.md",
          "recorded_at": "2026-09-01",
          "summary": "SPEC §11.3 句柄四元组；§11 reconcile 四分支明确；当前实现已持久化句柄并实现 reattach/collect/orphan grace/fence 分支。"
        }
      ]
    },
    {
      "id": "lhgp-spec-goal-capsule-v1",
      "statement": "Goal Capsule v1：9 元组结构化上下文 + provenance + fact/decision/hypothesis/untrusted 四种标记（SPEC §11.1）；属 P3 范围。",
      "lifecycle": "verified",
      "scope_paths": [
        "docs/LHGP-SPEC.md"
      ],
      "evidence": [
        {
          "kind": "source_static",
          "path": "docs/LHGP-SPEC.md",
          "recorded_at": "2026-09-01",
          "summary": "SPEC §11.1 列 9 元组（subject/scope/acceptance/constraints/authority/continuity/forecast/evidence/provenance）与四种标记。"
        }
      ]
    },
    {
      "id": "lhgp-spec-forecast-six-component",
      "statement": "六分量 forecast（SPEC §10.2）：queue / startup / remaining work / verification / retry reserve / safety margin；含 p50/p90 与 P(finish)；驱动事件式 wakeup 与 next_decision_at。属 P4 范围。",
      "lifecycle": "verified",
      "scope_paths": [
        "docs/LHGP-SPEC.md"
      ],
      "evidence": [
        {
          "kind": "source_static",
          "path": "docs/LHGP-SPEC.md",
          "recorded_at": "2026-09-01",
          "summary": "SPEC §10.2 六分量定义；§10.3 风险六档阈值；§10.4 决策时刻 next_decision_at。"
        }
      ]
    },
    {
      "id": "lhgp-spec-typed-acceptance",
      "statement": "验收 checks 分为 7 种 typed checks（SPEC §12.1），每条 check 关联 evidence 实体；mandatory / optional 分类；typed target 必须是非空字符串且 args 必须为对象；verifier 必须独立于 executor（不同 attempt / 不同 session / 优先不同 model family）；target 一律相对 workspace_root 解析；command check 在守护进程环境执行（shell=False、cwd=workspace_root、继承 daemon PATH），解释器缺失产出 undetermined 并给可行动指引（区别于 fail）；属 P5 范围。",
      "lifecycle": "verified",
      "scope_paths": [
        "docs/LHGP-SPEC.md",
        "src/lhgp/acceptance/evaluator.py",
        "tests/unit/test_p5_acceptance.py"
      ],
      "evidence": [
        {
          "kind": "source_static",
          "path": "docs/LHGP-SPEC.md",
          "recorded_at": "2026-09-04",
          "summary": "SPEC §12.1 七种 check + target 解析约定（相对 workspace_root，不带重复前缀）+ command check 环境契约（守护进程环境、解释器缺失 undetermined 非 fail）；§12.2 evidence 实体；§12.3 verifier 独立性；§12.4 证据双通道与裁决合成。"
        },
        {
          "kind": "source_static",
          "path": "src/lhgp/acceptance/evaluator.py",
          "recorded_at": "2026-09-04",
          "summary": "command-not-found 分支：FileNotFoundError → undetermined 且 details 带 daemon PATH 指引（绝对解释器路径 / §12.4 verifier 判定块）——区别于 fail（「跑不了」与「跑挂了」是不同的事实）。对应测试见 tests/unit/test_p5_acceptance.py（undetermined 带指引回归、target 相对 workspace_root 解析）——focused_test 证据挂在与实现绑定的 ephemeral-context-and-verifier 声明下。"
        },
        {
          "kind": "source_static",
          "path": "tests/unit/test_p5_acceptance.py",
          "recorded_at": "2026-09-05",
          "summary": "CheckSpec 的 mandatory 字段只接受 JSON boolean；target 必须为非空字符串、args 必须为对象；字符串等错误类型明确拒绝，避免 optional check 被隐式升级为 mandatory 或生成不可验证目标。"
        }
      ]
    },
    {
      "id": "lhgp-spec-distribution-and-rename",
      "statement": "分发形态（SPEC §3、§14、§15）：`.codex-plugin/plugin.json`、`.mcp.json`、`skills/long-horizon-goals/SKILL.md`、assets/；MCP 工具迁移为 10 个 `lhgp_*`；命令迁移 `longtask→lhgp`、`longtaskd→lhgpd`、数据目录 `~/.longtask→~/.lhgp`，旧名保留至少一个次版本。属 P6 范围。",
      "lifecycle": "verified",
      "scope_paths": [
        "docs/LHGP-SPEC.md",
        "docs/decisions/0003-long-horizon-goal-protocol.md",
        "docs/LHGP-ROADMAP.md"
      ],
      "evidence": [
        {
          "kind": "source_static",
          "path": "docs/LHGP-SPEC.md",
          "recorded_at": "2026-09-01",
          "summary": "SPEC §3（外部表面）、§14（分发）、§15（运行）；§19.3 改名最后原则。"
        },
        {
          "kind": "manual_review",
          "path": "docs/decisions/0003-long-horizon-goal-protocol.md",
          "recorded_at": "2026-09-01",
          "summary": "ADR-0003 命名权威：协议正式名 LHGP（Long-Horizon Goal Protocol），目标态 lhgp / lhgpd / ~/.lhgp，迁移窗口由 P6 安排。"
        }
      ]
    }
  ],
  "implementation_claims": [
    {
      "id": "verifier-evidence-bound-to-acceptance-content",
      "statement": "完成结论与验收内容绑定且绑定时机正确：指纹由 runtime 按 attempt 准入时的不可变修订快照计算；user_confirm 只采信与当前验收一致的指纹，指纹缺失、不一致或调用方改动 spec_hash 标记者一律 STATE_FORBIDDEN 并要求重新核验",
      "lifecycle": "verified",
      "scope_paths": [
        "src/lhgp/contracts/acceptance.py",
        "src/longtask/persistence/store.py",
        "src/longtask/rpc/handlers/contract.py",
        "src/longtask/cli/runner.py",
        "src/longtask/promoter/reconcile.py",
        "src/longtask/rpc/executor_api.py",
        "tests/unit/test_acceptance_content_binding.py",
        "tests/integration/test_verifier_evidence_timing.py"
      ],
      "evidence": [
        {
          "kind": "focused_test",
          "path": "tests/unit/test_acceptance_content_binding.py",
          "recorded_at": "2026-09-10",
          "summary": "第 8 轮外部审查复现的四种 spec_hash 组合（双缺/编辑丢标/事后加标/双标）在验收被改后均拒绝完成；无内容标识的旧证据拒绝；未改动验收的正常路径仍可完成；三个证据生产端（runner 回收、reconcile 崩溃恢复、write-back）均被扫描要求盖章。"
        },
        {
          "kind": "focused_test",
          "path": "tests/unit/test_plan_approval_migration.py",
          "recorded_at": "2026-09-10",
          "summary": "第 7 轮的两侧不同哈希拒绝路径仍绿，证明本次收紧未放宽任何已有判定。"
        },
        {
          "kind": "integration_real_store",
          "path": "tests/integration/test_verifier_evidence_timing.py",
          "recorded_at": "2026-09-10",
          "summary": "第 9 轮审查复现的「核验运行中修订验收」：驱动真实回收路径（AttemptRunner._finish_attempt）与真实修订链，断言事件携带的是准入修订的指纹而非当前行；同文件包含无修订时应能完成的阳性对照。已做反向验证：把绑定改回读当前行后该组测试变红（其中一条 DID NOT RAISE）。"
        }
      ]
    },
    {
      "id": "skeleton-gates-green",
      "statement": "骨架代码通过全部七道质量门（format/lint/arch/deps/claims/typecheck/test+coverage），门自身 fail-closed",
      "lifecycle": "verified",
      "scope_paths": [
        "src/",
        "scripts/",
        "tests/",
        "pyproject.toml"
      ],
      "evidence": [
        {
          "kind": "gate_run",
          "path": "quality/evidence/gate-run-20260831.md",
          "recorded_at": "2026-08-31",
          "summary": "七道门首跑全绿；首跑真实拦下 format/lint/test/coverage 四类问题并修复，证明门不是摆设。"
        }
      ]
    },
    {
      "id": "urgency-tier-thresholds",
      "statement": "紧迫度分档实现与 DESIGN §6.2 默认阈值表一致（0.25/0.5/1.0/1.5），越 Deadline 返回 None 走仲裁不走阶梯",
      "lifecycle": "verified",
      "scope_paths": [
        "src/longtask/promoter/urgency.py",
        "tests/unit/test_urgency.py"
      ],
      "evidence": [
        {
          "kind": "focused_test",
          "path": "tests/unit/test_urgency.py",
          "recorded_at": "2026-08-31",
          "summary": "公式比值、Deadline 越界返回 None、负工作量拒收、五档边界（含 0.25/0.5/1.0 含下界）、自定义阈值、乱序阈值拒收。"
        }
      ]
    },
    {
      "id": "lease-fencing-logic",
      "statement": "写回 generation/attempt 与当前租约不符即 LeaseFencedError（DESIGN §7），旧执行者苏醒写回不污染新 attempt",
      "lifecycle": "verified",
      "scope_paths": [
        "src/longtask/promoter/lease.py",
        "tests/unit/test_lease_fencing.py"
      ],
      "evidence": [
        {
          "kind": "focused_test",
          "path": "tests/unit/test_lease_fencing.py",
          "recorded_at": "2026-08-31",
          "summary": "心跳边界、过期/超前 generation 双路 fenced、同代次非持有人 fenced、分区路径前缀/阶段/id 三类互斥拒收。"
        }
      ]
    },
    {
      "id": "error-code-registry-complete",